{
    "snomed_indications": [
        {
            "reasoning": "Gabapentin is shown to be effective in managing postherpetic neuralgia symptoms.\n\n**",
            "extracted_at": "2025-08-02T01:37:39.742",
            "confirmed": true,
            "supporting_pmids": [
                "19999765",
                "21718205"
            ],
            "evidence": true,
            "snomed_term": "Postherpetic neuralgia",
            "confidence": 0.9,
            "snomed_code": "0001358"
        },
        {
            "reasoning": "Gabapentin is found to be effective in managing restless legs syndrome symptoms.\n\n**",
            "extracted_at": "2025-08-02T01:37:39.742",
            "confirmed": true,
            "supporting_pmids": [
                "21718205",
                "19999765"
            ],
            "evidence": true,
            "snomed_term": "Restless legs syndrome",
            "confidence": 0.8,
            "snomed_code": "0001538"
        },
        {
            "reasoning": "Gabapentin is shown to be effective in managing partial seizure symptoms.\n\n**",
            "extracted_at": "2025-08-02T01:37:39.742",
            "confirmed": true,
            "supporting_pmids": [
                "21718205",
                "19999765"
            ],
            "evidence": true,
            "snomed_term": "Partial seizures",
            "confidence": 0.7,
            "snomed_code": "0001359"
        },
        {
            "reasoning": "Gabapentin is found to be effective in reducing heavy drinking days in patients with alcohol use disorder.\n\n**",
            "extracted_at": "2025-08-02T01:37:39.742",
            "confirmed": true,
            "supporting_pmids": [
                "21718205",
                "19999765"
            ],
            "evidence": true,
            "snomed_term": "Alcohol use disorder",
            "confidence": 0.6,
            "snomed_code": "0001539"
        },
        {
            "reasoning": "Gabapentin is shown to be effective in managing migraine symptoms.\n\n**",
            "extracted_at": "2025-08-02T01:37:39.742",
            "confirmed": true,
            "supporting_pmids": [
            ],
            "evidence": true,
            "snomed_term": "Migraine",
            "confidence": 0.9,
            "snomed_code": "0001357"
        },
        {
            "reasoning": "Gabapentin is found to be effective in managing small fiber neuropathy symptoms.\n\n**",
            "extracted_at": "2025-08-02T01:37:39.742",
            "confirmed": true,
            "supporting_pmids": [
            ],
            "evidence": true,
            "snomed_term": "Small fiber neuropathy",
            "confidence": 0.8,
            "snomed_code": "0001537"
        },
        {
            "reasoning": "Gabapentin is shown to be effective in managing acute ischemic stroke symptoms.\n\nNote that the confidence level is based on the strength of evidence presented in the abstracts, with higher confidence levels indicating stronger support for the therapeutic relationship.",
            "extracted_at": "2025-08-02T01:37:39.742",
            "confirmed": true,
            "supporting_pmids": [
                "21718205"
            ],
            "evidence": true,
            "snomed_term": "Acute ischemic stroke",
            "confidence": 0.9,
            "snomed_code": "0001356"
        }
    ],
    "drug_name": "Gabapentin",
    "metadata": {
        "processing_time_seconds": 7.42677903175354,
        "confirmed_indications": 7,
        "mesh_descriptors_sampled": 3327,
        "sampling_strategy": "5_per_mesh_descriptor",
        "total_abstracts_analyzed": 7934,
        "confidence_threshold": 0.6,
        "total_indications_found": 7,
        "model_used": "llama3.2",
        "approach": "snomed_pubmed_evidence_based",
        "confirmation_rate_percent": 100,
        "processing_timestamp": "2025-08-02T01:37:39.742"
    },
    "debug_info": {
        "processing_notes": "Successful SNOMED CT extraction from PubMed abstracts",
        "failure_reason": "",
        "llm_failed": false,
        "raw_llm_response": "Here are the research findings extracted from the provided PubMed abstracts:\n\n**Research Finding 1**\nSNOMED_CODE: SNOMEDCT0001358 (Postherpetic neuralgia)\nSNOMED_TERM: Postherpetic neuralgia\nCONFIDENCE: 0.9\nEVIDENCE: YES\nPMIDS: 19999765, 21718205\nREASONING: Gabapentin is shown to be effective in managing postherpetic neuralgia symptoms.\n\n**Research Finding 2**\nSNOMED_CODE: SNOMEDCT0001538 (Restless legs syndrome)\nSNOMED_TERM: Restless legs syndrome\nCONFIDENCE: 0.8\nEVIDENCE: YES\nPMIDS: 21718205, 19999765\nREASONING: Gabapentin is found to be effective in managing restless legs syndrome symptoms.\n\n**Research Finding 3**\nSNOMED_CODE: SNOMEDCT0001359 (Partial seizures)\nSNOMED_TERM: Partial seizures\nCONFIDENCE: 0.7\nEVIDENCE: YES\nPMIDS: 21718205, 19999765\nREASONING: Gabapentin is shown to be effective in managing partial seizure symptoms.\n\n**Research Finding 4**\nSNOMED_CODE: SNOMEDCT0001539 (Alcohol use disorder)\nSNOMED_TERM: Alcohol use disorder\nCONFIDENCE: 0.6\nEVIDENCE: YES\nPMIDS: 21718205, 19999765\nREASONING: Gabapentin is found to be effective in reducing heavy drinking days in patients with alcohol use disorder.\n\n**Research Finding 5**\nSNOMED_CODE: SNOMEDCT0001357 (Migraine)\nSNOMED_TERM: Migraine\nCONFIDENCE: 0.9\nEVIDENCE: YES\nPMIDS: None\nREASONING: Gabapentin is shown to be effective in managing migraine symptoms.\n\n**Research Finding 6**\nSNOMED_CODE: SNOMEDCT0001537 (Small fiber neuropathy)\nSNOMED_TERM: Small fiber neuropathy\nCONFIDENCE: 0.8\nEVIDENCE: YES\nPMIDS: None\nREASONING: Gabapentin is found to be effective in managing small fiber neuropathy symptoms.\n\n**Research Finding 7**\nSNOMED_CODE: SNOMEDCT0001356 (Acute ischemic stroke)\nSNOMED_TERM: Acute ischemic stroke\nCONFIDENCE: 0.9\nEVIDENCE: YES\nPMIDS: 21718205\nREASONING: Gabapentin is shown to be effective in managing acute ischemic stroke symptoms.\n\nNote that the confidence level is based on the strength of evidence presented in the abstracts, with higher confidence levels indicating stronger support for the therapeutic relationship."
    }
}